file;wa_num;module_code;license_module;menu_path_ru;screen_name;screen_type;parent_screen;is_empty;notes;priority;tr_specific;az_note;screenshot_path
IMG-20260522-WA0056.jpg;56;SETTINGS;PMS;Персонализация → Информация по лицензии;Nafta Sanatorium Hotel Лицензия;info;Персонализация;false;Список активных модулей лицензии (PMS, POS, SPA, STOCK и др.);must;no;skip;doc/screens/IMG-20260522-WA0056.jpg
IMG-20260522-WA0057.jpg;57;SETTINGS;ChannelManager;Персонализация → Выбранные модули;Выбранные модули;settings;Персонализация;false;Чекбоксы включенных модулей (Channel Manager, SPA, Управление задачами);must;no;skip;doc/screens/IMG-20260522-WA0057.jpg
IMG-20260522-WA0058.jpg;58;REPORTS;PMS;Отчеты Менеджера;Отчеты в формате PDF;list;Главное меню;false;Сетка кнопок быстрого доступа к PDF-отчетам (Ежедневное управление, Итоги и т.д.);should;no;skip;doc/screens/IMG-20260522-WA0058.jpg
IMG-20260522-WA0059.jpg;59;REPORTS;PMS;Отчеты Менеджера;Отчеты Менеджера;dashboard;Главное меню;false;Панель анализа: Заполняемость, Продажи, Квоты. Фильтры по датам в шапке;should;no;skip;doc/screens/IMG-20260522-WA0059.jpg
IMG-20260522-WA0060.jpg;60;SETTINGS;SETTINGS;Персонализация → Быстрая настройка отеля;Пользователь;list;Быстрая настройка;false;Таблица пользователей системы: Роли, Срок действия, Права доступа;must;no;skip;doc/screens/IMG-20260522-WA0060.jpg
IMG-20260522-WA0061.jpg;61;SETTINGS;SETTINGS;Персонализация → Быстрая настройка отеля;Общая информация;form;Быстрая настройка;false;Базовый профиль отеля: Логотип, Вместимость, Валюта, Координаты карты;must;no;skip;doc/screens/IMG-20260522-WA0061.jpg
IMG-20260522-WA0062.jpg;62;SETTINGS;SETTINGS;Персонализация → Быстрая настройка отеля;Тип Ном.;list;Быстрая настройка;false;Справочник типов номеров (STWN, SDBL, DLX) с коэффициентами вместимости;must;no;skip;doc/screens/IMG-20260522-WA0062.jpg
IMG-20260522-WA0063.jpg;63;SETTINGS;SETTINGS;Персонализация → Быстрая настройка отеля;Тип Пит.;list;Быстрая настройка;false;Справочник типов питания (BB, HB, FB, OB) и цены за доп. питание;must;no;skip;doc/screens/IMG-20260522-WA0063.jpg
IMG-20260522-WA0064.jpg;64;SETTINGS;SETTINGS;Персонализация → Быстрая настройка отеля;Тип Тарифа;list;Быстрая настройка;false;Справочник тарифов (Refundable, Medical, Daily rates);must;no;skip;doc/screens/IMG-20260522-WA0064.jpg
IMG-20260522-WA0065.jpg;65;SETTINGS;SETTINGS;Персонализация → Быстрая настройка отеля;Номер;list;Быстрая настройка;false;Физический номерной фонд (связка № комнаты, типа номера и этажа);must;no;skip;doc/screens/IMG-20260522-WA0065.jpg
IMG-20260522-WA0066.jpg;66;SETTINGS;ACC;Персонализация → Быстрая настройка отеля;Коды дохода;list;Быстрая настройка;false;Справочник Revenue Codes (ROOM, FOOD, SPA STORE, MEDICAL) с НДС;must;no;NAS/1C;doc/screens/IMG-20260522-WA0066.jpg
IMG-20260522-WA0067.jpg;67;SETTINGS;SETTINGS;Персонализация → Быстрая настройка отеля;Отдел;list;Быстрая настройка;false;Физические и логические департаменты (Accommodation, Restaurant, Laundry);must;no;NAS/1C;doc/screens/IMG-20260522-WA0067.jpg
IMG-20260522-WA0068.jpg;68;SETTINGS;ChannelManager;Персонализация → Быстрая настройка отеля;Каналы Продаж (OTA);list;Быстрая настройка;false;Настройки подключений OTA (Booking, Expedia, Exely);must;no;skip;doc/screens/IMG-20260522-WA0068.jpg
IMG-20260522-WA0069.jpg;69;SETTINGS;SETTINGS;Персонализация → Быстрая настройка отеля;Настройки;list;Быстрая настройка;false;Меню детальных настроек (Фото, Счет-фактуры, Платежные шлюзы);should;no;skip;doc/screens/IMG-20260522-WA0069.jpg
IMG-20260522-WA0070.jpg;70;SETTINGS;FixedAsset;Персонализация → Панель настроек отеля;Основные определения отеля;menu;Панель настроек;false;Дашборд кнопок-ссылок ко всем справочникам (Отель, Пользователи, Номера);must;no;skip;doc/screens/IMG-20260522-WA0070.jpg
IMG-20260522-WA0071.jpg;71;SETTINGS;SETTINGS;Персонализация → Панель настроек отеля;Определения CRM / Доп. сборы;menu;Панель настроек;false;Ссылки на настройки задач, анкет, мероприятий и сборов;should;no;skip;doc/screens/IMG-20260522-WA0071.jpg
IMG-20260522-WA0072.jpg;72;SETTINGS;ACC;Персонализация → Панель настроек отеля;Бухгалтерские определения;menu;Панель настроек;false;Ссылки на справочники касс, валют, налогов и тарифов;must;no;NAS/1C;doc/screens/IMG-20260522-WA0072.jpg
IMG-20260522-WA0073.jpg;73;SETTINGS;SETTINGS;Персонализация → Панель настроек отеля;Настройки лояльности / API;menu;Панель настроек;false;Ссылки на справочники бонусов, API-ключей, SMS-шаблонов;nice;no;skip;doc/screens/IMG-20260522-WA0073.jpg
IMG-20260522-WA0074.jpg;74;SETTINGS;ChannelManager;Персонализация → Панель настроек отеля;Установка channel manager;menu;Панель настроек;false;Ссылки на настройки синхронизации, SEO, онлайн-регистрации;must;no;skip;doc/screens/IMG-20260522-WA0074.jpg
IMG-20260522-WA0075.jpg;75;SETTINGS;SETTINGS;Изменение данных отеля → Информация об отеле;Информация об отеле;form;Изменение данных;false;Дублирует экран 0061 с расширенными настройками лицензии;must;no;skip;doc/screens/IMG-20260522-WA0075.jpg
IMG-20260522-WA0076.jpg;76;SETTINGS;SETTINGS;Персонализация → Панель настроек отеля;Другие определения;menu;Панель настроек;false;Настройки печати, WhatsApp API, Соглашения (GDPR);should;no;skip;doc/screens/IMG-20260522-WA0076.jpg
IMG-20260522-WA0077.jpg;77;SETTINGS;SETTINGS;Изменение данных отеля → Добавить фото типа номера;Фото;form;Изменение данных;false;Drag&Drop загрузчик галереи для типов номеров;should;no;skip;doc/screens/IMG-20260522-WA0077.jpg
IMG-20260522-WA0078.jpg;78;SETTINGS;SETTINGS;Изменение данных отеля → Добавить фото отеля;Фото;form;Изменение данных;false;Загрузчик общих фотографий отеля (Drag&Drop);should;no;skip;doc/screens/IMG-20260522-WA0078.jpg
IMG-20260522-WA0079.jpg;79;SETTINGS;PMS;Изменение данных отеля → Адрес электронной почты;Адрес электронной почты;form;Изменение данных;false;Маппинг e-mail адресов по департаментам (Фронт-офис, Бухгалтерия);should;no;skip;doc/screens/IMG-20260522-WA0079.jpg
IMG-20260522-WA0080.jpg;80;SETTINGS;SETTINGS;Изменение данных отеля → Настройки отеля по умолч.;Настройки отеля по умолчанию;form;Изменение данных;false;Назначение отделов по умолчанию (Accommodation, Трансфер, Cash);must;no;skip;doc/screens/IMG-20260522-WA0080.jpg
IMG-20260522-WA0081.jpg;81;SETTINGS;ACC;Изменение данных отеля → Настройки отеля по умолч.;Настройки уведомлений и учета;form;Настройки по умолч.;false;Полицейская интеграция и маппинг главных бухгалтерских счетов;must;yes;tourism registry;doc/screens/IMG-20260522-WA0081.jpg
IMG-20260522-WA0082.jpg;82;SETTINGS;SETTINGS;Изменение данных отеля → Настройки отеля по умолч.;Настройки темы / SMS;form;Настройки по умолч.;false;Аккордеоны настроек визуала (Фавикон) и провайдера SMS;should;no;skip;doc/screens/IMG-20260522-WA0082.jpg
IMG-20260522-WA0083.jpg;83;SETTINGS;PMS;Изменение данных отеля → Настройки отеля по умолч. 2;Другие настройки бронирования;settings;Изменение данных;false;Огромный список тумблеров бизнес-логики (правила отмены, овербукинг);must;yes;skip;doc/screens/IMG-20260522-WA0083.jpg
IMG-20260522-WA0084.jpg;84;SETTINGS;PMS;Изменение данных отеля → Настройки отеля по умолч. 2;Настройки бронирования;settings;Изменение данных;false;Обязательные поля карточки гостя, дефолтные типы питания и рынки;must;no;skip;doc/screens/IMG-20260522-WA0084.jpg
IMG-20260522-WA0085.jpg;85;SETTINGS;SETTINGS;Изменение данных отеля → Настройки отеля по умолч. 2;Настройка доступных номеров;settings;Изменение данных;false;Настройки курсов валют, трансферов и стоек регистрации;must;no;skip;doc/screens/IMG-20260522-WA0085.jpg
IMG-20260522-WA0086.jpg;86;SETTINGS;SETTINGS;Изменение данных отеля → Настройки отеля по умолч. 2;Описание отдела по умолчанию;settings;Изменение данных;false;Маппинг выручки (Банкеты, Ранний заезд, Парковка) к отделам;must;no;NAS/1C;doc/screens/IMG-20260522-WA0086.jpg
IMG-20260522-WA0087.jpg;87;SETTINGS;SETTINGS;Изменение данных отеля → Настройки отеля по умолч. 2;Folio Settings / Настройки гостя;settings;Изменение данных;false;Требования к заполнению профиля гостя (Паспорт, Телефон, E-mail);must;yes;skip;doc/screens/IMG-20260522-WA0087.jpg
IMG-20260522-WA0088.jpg;88;SETTINGS;SETTINGS;Изменение данных отеля → Настройки отеля по умолч. 2;Настройки завершения дня;settings;Изменение данных;false;Триггеры End Of Day (Асинхронное завершение, проверка касс);must;no;skip;doc/screens/IMG-20260522-WA0088.jpg
IMG-20260522-WA0089.jpg;89;SETTINGS;SETTINGS;Изменение данных отеля → Настройки отеля по умолч. 2;Настройки ресторана / Групп;settings;Изменение данных;false;Настройки A-la-carte броней и видимости групповых доходов;should;no;skip;doc/screens/IMG-20260522-WA0089.jpg
IMG-20260522-WA0090.jpg;90;SETTINGS;SETTINGS;Изменение данных отеля → Настройки отеля по умолч. 2;Настройки службы уборки (СУН);settings;Изменение данных;false;Логика हाउसкипинга (смена белья, период проверки минибара);must;no;skip;doc/screens/IMG-20260522-WA0090.jpg
IMG-20260522-WA0091.jpg;91;SETTINGS;SETTINGS;Изменение данных отеля → Настройки отеля по умолч. 2;Настройка счета;settings;Изменение данных;false;Требования к инвойсам (City Ledger, Автоматическое создание счета);must;yes;e-qaimə;doc/screens/IMG-20260522-WA0091.jpg
IMG-20260522-WA0092.jpg;92;SETTINGS;STOCK;Изменение данных отеля → Настройки отеля по умолч. 2;Настройка склада;settings;Изменение данных;false;Использование FIFO для запасов, Бух. коды наличных/кредиток;must;no;NAS/1C;doc/screens/IMG-20260522-WA0092.jpg
IMG-20260522-WA0093.jpg;93;SETTINGS;SETTINGS;Изменение данных отеля → Настройки отеля по умолч. 2;Настройки почты;settings;Изменение данных;false;Баннеры для писем, параметры SMTP, данные Elektra Tenant;must;no;skip;doc/screens/IMG-20260522-WA0093.jpg
IMG-20260522-WA0094.jpg;94;SETTINGS;SETTINGS;Изменение данных отеля → Настройки отеля по умолч. 2;Информация отеля в счете;form;Изменение данных;false;Юр.лицо, IBAN, Регистрационный номер для выставления счетов;must;yes;e-qaimə;doc/screens/IMG-20260522-WA0094.jpg
IMG-20260522-WA0095.jpg;95;SETTINGS;ACC;Изменение данных отеля → Настройки отеля по умолч. 2;Настройки автоматизации парка;form;Изменение данных;false;Интеграция SFTP и прайсы для парковки / соц. сети;should;no;skip;doc/screens/IMG-20260522-WA0095.jpg
IMG-20260522-WA0096.jpg;96;SETTINGS;PMS;Изменение данных отеля → Параметры конфигурации;Параметры конфигурации;list;Изменение данных;false;Системные константы и параметры модулей (EASYPMS, Stok);should;no;skip;doc/screens/IMG-20260522-WA0096.jpg
IMG-20260522-WA0097.jpg;97;ACC;ACC;Изменение данных отеля → Настройки бухгалтерии...;Настройки бухгалтерского учета;form;Изменение данных;false;Глубокий маппинг счетов: Сейфы, Зарплата, Кредиты, Курсовая разница;must;no;NAS/1C;doc/screens/IMG-20260522-WA0097.jpg
IMG-20260522-WA0098.jpg;98;POS;POS;Изменение данных отеля → Настройки Pos-терминала...;Настройки Pos-терминала по умолч.;form;Изменение данных;false;Визуальный конструктор и настройки печати чеков ресторана;must;yes;KKM;doc/screens/IMG-20260522-WA0098.jpg
IMG-20260522-WA0099.jpg;99;MAINTENANCE;OTHER;Изменение данных отеля → Экраны обслуживания;Экраны обслуживания;list;Изменение данных;false;Служебные утилиты пересчета (Сводка, Счета, Статистика);should;no;skip;doc/screens/IMG-20260522-WA0099.jpg
IMG-20260522-WA0100.jpg;100;MAINTENANCE;OTHER;Изменение данных отеля → Экраны обслуживания;Экраны обслуживания (низ);list;Изменение данных;false;Служебные действия: Объединение гостей, Удаление дубликатов;should;no;skip;doc/screens/IMG-20260522-WA0100.jpg
IMG-20260522-WA0101.jpg;101;SETTINGS;SETTINGS;Изменение данных отеля → Нотификация;EMPTY;empty;Изменение данных;true;из меню: Нотификация;nice;;;doc/screens/IMG-20260522-WA0101.jpg
IMG-20260522-WA0102.jpg;102;SETTINGS;SETTINGS;Изменение данных отеля → Нотификация;Отправленные уведомления;list;Изменение данных;false;Журнал отправленных системных пушей и писем;nice;no;skip;doc/screens/IMG-20260522-WA0102.jpg
IMG-20260522-WA0103.jpg;103;SETTINGS;SETTINGS;Изменение данных отеля → Нотификация;Матрица уведомлений;grid;Изменение данных;false;Большая таблица прав (Чекбоксы ролей и доступов к уведомлениям);must;no;skip;doc/screens/IMG-20260522-WA0103.jpg
IMG-20260522-WA0104.jpg;104;PMS;PMS;Фронт-офис → Доступность Типа Номера;Доступность Типа Номера;grid;Фронт-офис;false;Классическая шахматка квот по типам номеров и датам (Всего/Доступно);must;no;skip;doc/screens/IMG-20260522-WA0104.jpg
IMG-20260522-WA0105.jpg;105;PMS;PMS;Фронт-офис → Анализ динамической доступности...;Доступность Типа Номера;chart;Фронт-офис;false;Визуальная гистограмма занятости: Занято, Свободно, Блок, Обслуживание;must;no;skip;doc/screens/IMG-20260522-WA0105.jpg
IMG-20260522-WA0106.jpg;106;PMS;PMS;Фронт-офис → Групповые Бронирования;Групповые Бронирования;list;Фронт-офис;false;Управление блоками групп (Точный, Предварительный, Отмененный);should;no;skip;doc/screens/IMG-20260522-WA0106.jpg
IMG-20260522-WA0107.jpg;107;PMS;PMS;Фронт-офис → Текущая Статус;Dashboard (Статусы);dashboard;Фронт-офис;false;Графики по планам питания (BB/HB/FB) и статусу проживания;must;no;skip;doc/screens/IMG-20260522-WA0107.jpg
IMG-20260522-WA0108.jpg;108;CASH;PMS;Касса → Список счетов-фактур;Список счетов отеля;list;Касса;false;Реестр выставленных инвойсов (City Ledger, Наличные, Отмененные);must;yes;e-qaimə;doc/screens/IMG-20260522-WA0108.jpg
IMG-20260522-WA0109.jpg;109;PMS;PMS;Фронт-офис → Текущая Статус;Dashboard (Прогноз/Доходы);dashboard;Фронт-офис;false;Сводка заездов-выездов (Pax/Rooms) и виджет текущего дохода/курсов;must;no;skip;doc/screens/IMG-20260522-WA0109.jpg
IMG-20260522-WA0110.jpg;110;PMS;PMS;Фронт-офис → Планы по изменению номера;Планы по изменению номера;list;Фронт-офис;false;Лог планируемых переселений гостей (Room Move);should;no;skip;doc/screens/IMG-20260522-WA0110.jpg
IMG-20260522-WA0111.jpg;111;PMS;PMS;Фронт-офис → Планы по изменению номера;EMPTY;empty;Фронт-офис;true;из меню: Планы по изменению номера;nice;;;doc/screens/IMG-20260522-WA0111.jpg
IMG-20260522-WA0112.jpg;112;PMS;PMS;Список в полицию → KBS List Archive;KBS List Archive;list;Список в полицию;false;Журнал автоматической выгрузки списков гостей в полицию;must;yes;tourism registry;doc/screens/IMG-20260522-WA0112.jpg
IMG-20260522-WA0113.jpg;113;CRM;PMS;CRM списки → Причины поездки;Причина поездки гостя;list;CRM списки;false;Статистика по целям визита (полезно для аналитики санатория);nice;no;skip;doc/screens/IMG-20260522-WA0113.jpg
IMG-20260522-WA0114.jpg;114;CRM;PMS;CRM списки → Причины поездки;EMPTY;empty;CRM списки;true;из меню: Причины поездки;nice;;;doc/screens/IMG-20260522-WA0114.jpg
IMG-20260522-WA0115.jpg;115;PMS;PMS;Фронт-офис → Свободные Номера;Свободные Номера;list;Фронт-офис;false;Поиск свободных комнат с фильтрами по свойствам кровати/виду;must;no;skip;doc/screens/IMG-20260522-WA0115.jpg
IMG-20260522-WA0116.jpg;116;CASH;PMS;Фронт-офис → Фолио-баланс бронирования;Бронирование с балансами фолио;list;Фронт-офис;false;Контроль задолженностей проживающих гостей;must;no;skip;doc/screens/IMG-20260522-WA0116.jpg
IMG-20260522-WA0117.jpg;117;PMS;PMS;Список в полицию → Автономное резервное копир...;Автономное резервное копирование;list;Главное меню;false;Экспорт списка In-House на случай падения интернета (Emergency);should;no;skip;doc/screens/IMG-20260522-WA0117.jpg
IMG-20260522-WA0118.jpg;118;CASH;PMS;Касса → City Ledger FollowUp;Agency Statement;report;Касса;false;Отчет сверки задолженностей агентств (City Ledger);must;no;NAS/1C;doc/screens/IMG-20260522-WA0118.jpg
IMG-20260522-WA0119.jpg;119;CRM;PMS;Экран Анкет → Подробный Анализ ответов...;Подробный анализ ответов на анкеты;report;Экран Анкет;false;Оценка качества сервиса по результатам гостевых опросов;should;no;skip;doc/screens/IMG-20260522-WA0119.jpg
IMG-20260522-WA0120.jpg;120;PMS;PMS;Фронт-офис → Анализ динамической доступности...;Доступность Типа Номера (Таблица);grid;Фронт-офис;false;Детальная сетка доступности (Продано/Вмещает) по датам;must;no;skip;doc/screens/IMG-20260522-WA0120.jpg
IMG-20260522-WA0121.jpg;121;CRM;PMS;Панель CRM → Отчет По Ежедневный Статус;Отчет По Ежедневный Статус;dashboard;Панель CRM;false;Главная сводка отеля: Вчера/Сегодня/Завтра (Rooms, PAX, Occupancy);must;no;skip;doc/screens/IMG-20260522-WA0121.jpg
IMG-20260522-WA0122.jpg;122;CRM;PMS;Панель CRM → Отчет По Ежедневный Статус;EMPTY;empty;Панель CRM;true;из меню: Отчет По Ежедневный Статус;nice;;;doc/screens/IMG-20260522-WA0122.jpg
IMG-20260522-WA0123.jpg;123;PMS;PMS;Фронт-офис → Текущая Статус;Dashboard (Статусы 2);dashboard;Фронт-офис;false;Комбинация графика загрузки и мини-таблицы доступности номеров;must;no;skip;doc/screens/IMG-20260522-WA0123.jpg
IMG-20260522-WA0124.jpg;124;PMS;PMS;Фронт-офис → Текущая Статус;Ожидаемые выезды;list;Фронт-офис;false;Сводка на сегодня: Ожидаемые заезды/выезды, информер менеджера;must;no;skip;doc/screens/IMG-20260522-WA0124.jpg
IMG-20260522-WA0125.jpg;125;PMS;PMS;Фронт-офис → Текущая Статус;Dashboard (Аналитика);dashboard;Фронт-офис;false;Круговые диаграммы демографии (Возраст) и % повторных гостей;must;no;skip;doc/screens/IMG-20260522-WA0125.jpg
IMG-20260522-WA0126.jpg;126;MED;PMS;Касса → Ежедневный мед. список гостей;Статусы здоровья гостей;list;Касса;false;Важнейший экран для санатория: Температура, Жалобы, Статус COVID;must;no;skip;doc/screens/IMG-20260522-WA0126.jpg
IMG-20260522-WA0127.jpg;127;PMS;PMS;Фронт-офис → Каналы Продаж (OTA);Цена И Доступность Для Онлайн Канала;grid;Фронт-офис;false;Интерфейс Channel Manager: Цены и квоты в разрезе по дням;must;no;skip;doc/screens/IMG-20260522-WA0127.jpg
IMG-20260522-WA0128.jpg;128;PMS;PMS;Фронт-офис → Каналы Продаж (OTA);EMPTY;empty;Фронт-офис;true;из меню: Каналы Продаж (OTA);nice;;;doc/screens/IMG-20260522-WA0128.jpg
IMG-20260522-WA0129.jpg;129;PMS;PMS;Список в полицию → Список Интерпола;Список Интерпола;list;Список в полицию;false;Экран проверки гостей по черным спискам;should;yes;tourism registry;doc/screens/IMG-20260522-WA0129.jpg
IMG-20260522-WA0130.jpg;130;PMS;PMS;Список в полицию → Список Интерпола;EMPTY;empty;Список в полицию;true;из меню: Список Интерпола;nice;;;doc/screens/IMG-20260522-WA0130.jpg
